{"id":"ai","title":"AI extension","version":"0.0.0-template","status":"planned","description":"Research-coverage template only; intentionally excluded from the local-only implementation roadmap.","permissions":["document:read","content:inspect","network:ai-service"],"dependencies":["ai-provider"],"capabilityIds":["ai.summarize","ai.ask-document","ai.extract-structured-data","ai.translate","ai.rewrite-proofread","ai.explain","ai.source-citations","ai.multi-document-analysis","ai.generate-images","ai.generate-bookmarks","ai.smart-redaction","ai.form-extraction","ai.accessibility-suggestions","ai.annotation-assist","ai.provider-policy-controls"]}
