{"id":"accessibility-remediation","title":"Accessibility remediation extension","version":"0.0.0-template","status":"planned","description":"Template contract for local tagged-PDF accessibility checks, reports, and human-reviewed repairs.","permissions":["document:read","document:write","content:inspect"],"dependencies":["local-tagging-validator"],"capabilityIds":["accessibility.check","accessibility.report-export","accessibility.auto-tag","accessibility.remediate-tags","accessibility.reading-order","accessibility.heading-list-structure","accessibility.table-semantics","accessibility.form-semantics","accessibility.links-bookmarks","accessibility.artifact-management","accessibility.alt-text","accessibility.document-language-title","accessibility.color-contrast","accessibility.font-unicode-mapping","accessibility.screen-reader-permissions"]}
