{"id":"ocr","title":"OCR extension","version":"0.0.0-template","status":"planned","description":"Template contract for local scan acquisition, recognition, verification, cleanup, and export.","permissions":["document:read","document:write","scan:acquire"],"dependencies":["local-ocr-engine"],"capabilityIds":["scan.acquire","scan.duplex-feeder","scan.append-to-document","ocr.recognize-text","ocr.cleanup","ocr.editable-output","ocr.suspect-review","ocr.language-detection-selection","ocr.zones-layout","ocr.table-recognition","ocr.user-dictionaries-training","ocr.batch-recognition","ocr.export-layout-preserving","ocr.screenshot-capture"]}
