{"id":"aec","title":"AEC extension","version":"0.0.0-template","status":"planned","description":"Template contract for local drawing calibration, measurement, takeoff, sets, revisions, and review.","permissions":["document:read","document:write","content:inspect"],"dependencies":["local-aec-measurement-engine"],"capabilityIds":["aec.measurement","aec.takeoff","aec.collaborative-review-sessions","aec.scale-calibration","aec.measurement-toolset","aec.markup-toolsets","aec.markups-list","aec.custom-columns-formulas","aec.spaces-regions","aec.sets-drawing-log","aec.sheet-metadata-tags","aec.revision-overlay","aec.batch-slip-sheet","aec.batch-link","aec.legends","aec.offline-projects","aec.revision-status-workflows","aec.geospatial-documents"]}
