{"id":"signing","title":"Signing extension","version":"0.0.0-template","status":"planned","description":"Template contract for local electronic and certificate signing, validation, trust, and audit evidence.","permissions":["document:read","document:write","identity:use","cryptography:sign"],"dependencies":["local-signature-provider"],"capabilityIds":["sign.electronic","sign.certificate","sign.validate-certificate","sign.routed-workflow","sign.audit-trail","sign.timestamp","sign.certify-document","sign.trust-store","sign.revocation-ltv","sign.visible-appearance","sign.digital-id-management","sign.batch-sign-seal","sign.identity-verification"]}
