{"id":"redaction","title":"Redaction extension","version":"0.0.0-template","status":"planned","description":"Template contract for local redaction marking, verification, irreversible application, and sanitization.","permissions":["document:read","document:write","content:inspect"],"dependencies":["local-redaction-engine"],"capabilityIds":["redaction.mark","redaction.preview","redaction.apply","redaction.find-patterns","redaction.overlay-labels","redaction.full-page","redaction.batch","redaction.report","sanitize.hidden-data","sanitize.metadata","sanitize.selective-content"]}
