{"id":"prepress","title":"Prepress extension","version":"0.0.0-template","status":"planned","description":"Template contract for local standards validation, preflight, color, and print production.","permissions":["document:read","document:write","content:inspect"],"dependencies":["local-preflight-engine"],"capabilityIds":["standards.pdf-a","standards.pdf-x","standards.pdf-ua","standards.pdf-e","standards.pdf-vt","standards.pdf-two","preflight.fixups","preflight.profiles","preflight.reports","preflight.certified-pdf","color.convert","color.output-intents","color.spot-colors","print.output-preview","print.separations","print.ink-coverage","print.overprint-preview","print.transparency-flattening","print.soft-proof","print.trapping","print.bleed-marks","print.imposition","print.font-inspection-embedding","print.image-resolution-compression","print.variable-data","print.barcode-decoration"]}
